{"artifact_plan":{"created_at":"2026-09-05T00:00:00Z","identity":{"plan_id":"example-identity-offboarding-campaign","plan_sha256":"dbf36e323ebd25ceb44dd258aa0956efcb81cb3edb19950ccc1b48738c13d771"},"limitations":["plan_binds_every_active_declared_workload_to_reviewed_artifact_metadata_at_declared_nodes","spiffe_ids_are_identifiers_only_and_do_not_prove_svid_issuance_validation_or_possession","slsa_fields_are_a_bounded_projection_not_statement_signature_or_build-platform_verification","ai_bom_fields_are_a_bounded_projection_not_spdx_or_cyclonedx_document_validation","plan_validation_does_not_fetch_scan_load_import_execute_or_deserialize_artifact_bytes"],"nodes":[{"enforcement_point_id":"credential-broker","node_id":"identity-credential-broker"},{"enforcement_point_id":"policy-gateway","node_id":"identity-policy-gateway"}],"plan_id":"lurebom-conformance-source","policy":{"allowed_model_serializations":["onnx","safetensors"],"approved_builder_ids":["https://github.com/actions/runner"],"model_embedded_code_allowed":false,"provenance_required_for_roles":["container_image","model_weights","policy_bundle"],"remote_model_code_allowed":false,"required_artifact_roles":["ai_sbom","container_image","model_weights","policy_bundle"],"sbom_subject_roles":["container_image","model_weights","policy_bundle"]},"schema":"https://github.com/immu4989/lurebench/spec/lureartifact-plan-v1","schema_version":1,"standards":{"provenance_predicate_type":"https://slsa.dev/provenance/v1","statement_type":"https://in-toto.io/Statement/v1","supported_ai_bom_formats":["cyclonedx-1.6","cyclonedx-1.7","spdx-3.0.1"]},"system_id":"example-agent-system","workloads":[{"ai_bom":{"artifact_id":"alpha-ai-bom","document_sha256":"76bf0b73e6ac970642b97a87cbd405c8ead9f66fc818622cc8d74f2ef0240dd4","format":"spdx-3.0.1","subject_artifact_ids":["alpha-container","alpha-model","alpha-policy"]},"artifacts":[{"artifact_id":"alpha-ai-bom","media_type":"application/spdx+json","model_embedded_code":false,"model_serialization":null,"package_url":null,"remote_code_required":false,"role":"ai_sbom","sha256":"76bf0b73e6ac970642b97a87cbd405c8ead9f66fc818622cc8d74f2ef0240dd4"},{"artifact_id":"alpha-container","media_type":"application/vnd.oci.image.manifest.v1+json","model_embedded_code":false,"model_serialization":null,"package_url":"pkg:oci/example/lureagent-alpha@sha256:aaaaaaaaaaaaaaaaaaaaaaaaaaaaaaaaaaaaaaaaaaaaaaaaaaaaaaaaaaaaaaaa","remote_code_required":false,"role":"container_image","sha256":"aaaaaaaaaaaaaaaaaaaaaaaaaaaaaaaaaaaaaaaaaaaaaaaaaaaaaaaaaaaaaaaa"},{"artifact_id":"alpha-model","media_type":"application/vnd.safetensors","model_embedded_code":false,"model_serialization":"safetensors","package_url":"pkg:huggingface/example/model-alpha@0123456789abcdef","remote_code_required":false,"role":"model_weights","sha256":"bbbbbbbbbbbbbbbbbbbbbbbbbbbbbbbbbbbbbbbbbbbbbbbbbbbbbbbbbbbbbbbb"},{"artifact_id":"alpha-policy","media_type":"application/vnd.openpolicyagent.bundle","model_embedded_code":false,"model_serialization":null,"package_url":"pkg:generic/example/alpha-policy@1.0.0","remote_code_required":false,"role":"policy_bundle","sha256":"cccccccccccccccccccccccccccccccccccccccccccccccccccccccccccccccc"}],"attestations":[{"attestation_id":"alpha-container-provenance","build_type":"https://github.com/actions/runner/build/v1","builder_id":"https://github.com/actions/runner","predicate_type":"https://slsa.dev/provenance/v1","source_sha256":"1111111111111111111111111111111111111111111111111111111111111111","statement_sha256":"eeeeeeeeeeeeeeeeeeeeeeeeeeeeeeeeeeeeeeeeeeeeeeeeeeeeeeeeeeeeeeee","statement_type":"https://in-toto.io/Statement/v1","subject_artifact_id":"alpha-container","subject_sha256":"aaaaaaaaaaaaaaaaaaaaaaaaaaaaaaaaaaaaaaaaaaaaaaaaaaaaaaaaaaaaaaaa"},{"attestation_id":"alpha-model-provenance","build_type":"https://github.com/actions/runner/build/v1","builder_id":"https://github.com/actions/runner","predicate_type":"https://slsa.dev/provenance/v1","source_sha256":"2222222222222222222222222222222222222222222222222222222222222222","statement_sha256":"ffffffffffffffffffffffffffffffffffffffffffffffffffffffffffffffff","statement_type":"https://in-toto.io/Statement/v1","subject_artifact_id":"alpha-model","subject_sha256":"bbbbbbbbbbbbbbbbbbbbbbbbbbbbbbbbbbbbbbbbbbbbbbbbbbbbbbbbbbbbbbbb"},{"attestation_id":"alpha-policy-provenance","build_type":"https://github.com/actions/runner/build/v1","builder_id":"https://github.com/actions/runner","predicate_type":"https://slsa.dev/provenance/v1","source_sha256":"3333333333333333333333333333333333333333333333333333333333333333","statement_sha256":"0000000000000000000000000000000000000000000000000000000000000000","statement_type":"https://in-toto.io/Statement/v1","subject_artifact_id":"alpha-policy","subject_sha256":"cccccccccccccccccccccccccccccccccccccccccccccccccccccccccccccccc"}],"node_ids":["identity-credential-broker","identity-policy-gateway"],"spiffe_id":"spiffe://example.com/agents/alpha","workload_principal_id":"workload-alpha"}]},"checks":["artifact_plan_contract_valid","manifest_contract_valid","primary_bom_bound_to_lureartifact","source_document_digests_bound","strict_source_json_reparsed","all_projected_components_explicitly_mapped","component_sha256_parity_recomputed","component_package_url_parity_recomputed","component_class_parity_recomputed","artifact_subject_bindings_recomputed","directed_dependency_parity_recomputed","producer_evaluation_reproduced","projection_loss_preserved"],"documents":{"cyclonedx":{"document_sha256":"2d8ee763f2b4dcf5c7d0b3353ab569295fc3069f6cd8919b54389ce1314f242d","format":"cyclonedx-1.7","payload_base64":"ewogICIkc2NoZW1hIjogImh0dHA6Ly9jeWNsb25lZHgub3JnL3NjaGVtYS9ib20tMS43LnNjaGVtYS5qc29uIiwKICAiYm9tRm9ybWF0IjogIkN5Y2xvbmVEWCIsCiAgInNwZWNWZXJzaW9uIjogIjEuNyIsCiAgInNlcmlhbE51bWJlciI6ICJ1cm46dXVpZDowMmQ4ZDJhMi0xZTA2LTRiMGYtYTJjNS05NDZmMDZhNWEwMDEiLAogICJ2ZXJzaW9uIjogMSwKICAibWV0YWRhdGEiOiB7CiAgICAidGltZXN0YW1wIjogIjIwMjYtMDktMDVUMDA6MDE6MDBaIiwKICAgICJjb21wb25lbnQiOiB7CiAgICAgICJib20tcmVmIjogInVybjpsdXJlYm9tOmN5Y2xvbmVkeDphbHBoYS1zeXN0ZW0iLAogICAgICAidHlwZSI6ICJhcHBsaWNhdGlvbiIsCiAgICAgICJuYW1lIjogIkx1cmVCT00gYWxwaGEgYWdlbnQgc3lzdGVtIiwKICAgICAgInZlcnNpb24iOiAiMS4wLjAiCiAgICB9CiAgfSwKICAiY29tcG9uZW50cyI6IFsKICAgIHsKICAgICAgImJvbS1yZWYiOiAidXJuOmx1cmVib206Y3ljbG9uZWR4OmFscGhhLWNvbnRhaW5lciIsCiAgICAgICJ0eXBlIjogImNvbnRhaW5lciIsCiAgICAgICJuYW1lIjogImx1cmVhZ2VudC1hbHBoYSIsCiAgICAgICJ2ZXJzaW9uIjogInNoYTI1NjphYWFhYWFhYWFhYWFhYWFhYWFhYWFhYWFhYWFhYWFhYWFhYWFhYWFhYWFhYWFhYWFhYWFhYWFhYWFhYWFhYWFhIiwKICAgICAgInB1cmwiOiAicGtnOm9jaS9leGFtcGxlL2x1cmVhZ2VudC1hbHBoYUBzaGEyNTY6YWFhYWFhYWFhYWFhYWFhYWFhYWFhYWFhYWFhYWFhYWFhYWFhYWFhYWFhYWFhYWFhYWFhYWFhYWFhYWFhYWFhYSIsCiAgICAgICJoYXNoZXMiOiBbCiAgICAgICAgewogICAgICAgICAgImFsZyI6ICJTSEEtMjU2IiwKICAgICAgICAgICJjb250ZW50IjogImFhYWFhYWFhYWFhYWFhYWFhYWFhYWFhYWFhYWFhYWFhYWFhYWFhYWFhYWFhYWFhYWFhYWFhYWFhYWFhYWFhYWEiCiAgICAgICAgfQogICAgICBdCiAgICB9LAogICAgewogICAgICAiYm9tLXJlZiI6ICJ1cm46bHVyZWJvbTpjeWNsb25lZHg6YWxwaGEtbW9kZWwiLAogICAgICAidHlwZSI6ICJtYWNoaW5lLWxlYXJuaW5nLW1vZGVsIiwKICAgICAgIm5hbWUiOiAibW9kZWwtYWxwaGEiLAogICAgICAidmVyc2lvbiI6ICIwMTIzNDU2Nzg5YWJjZGVmIiwKICAgICAgInB1cmwiOiAicGtnOmh1Z2dpbmdmYWNlL2V4YW1wbGUvbW9kZWwtYWxwaGFAMDEyMzQ1Njc4OWFiY2RlZiIsCiAgICAgICJoYXNoZXMiOiBbCiAgICAgICAgewogICAgICAgICAgImFsZyI6ICJTSEEtMjU2IiwKICAgICAgICAgICJjb250ZW50IjogImJiYmJiYmJiYmJiYmJiYmJiYmJiYmJiYmJiYmJiYmJiYmJiYmJiYmJiYmJiYmJiYmJiYmJiYmJiYmJiYmJiYmIiCiAgICAgICAgfQogICAgICBdLAogICAgICAibW9kZWxDYXJkIjogewogICAgICAgICJtb2RlbFBhcmFtZXRlcnMiOiB7CiAgICAgICAgICAiYXBwcm9hY2giOiB7InR5cGUiOiAic3VwZXJ2aXNlZCJ9CiAgICAgICAgfSwKICAgICAgICAiY29uc2lkZXJhdGlvbnMiOiB7CiAgICAgICAgICAidXNlQ2FzZXMiOiBbIkRlZmFuZ2VkIGZyYXVkLWx1cmUgZXZhbHVhdGlvbiJdCiAgICAgICAgfQogICAgICB9CiAgICB9LAogICAgewogICAgICAiYm9tLXJlZiI6ICJ1cm46bHVyZWJvbTpjeWNsb25lZHg6YWxwaGEtcG9saWN5IiwKICAgICAgInR5cGUiOiAiYXBwbGljYXRpb24iLAogICAgICAibmFtZSI6ICJhbHBoYS1wb2xpY3kiLAogICAgICAidmVyc2lvbiI6ICIxLjAuMCIsCiAgICAgICJwdXJsIjogInBrZzpnZW5lcmljL2V4YW1wbGUvYWxwaGEtcG9saWN5QDEuMC4wIiwKICAgICAgImhhc2hlcyI6IFsKICAgICAgICB7CiAgICAgICAgICAiYWxnIjogIlNIQS0yNTYiLAogICAgICAgICAgImNvbnRlbnQiOiAiY2NjY2NjY2NjY2NjY2NjY2NjY2NjY2NjY2NjY2NjY2NjY2NjY2NjY2NjY2NjY2NjY2NjY2NjY2NjY2NjY2NjYyIKICAgICAgICB9CiAgICAgIF0KICAgIH0sCiAgICB7CiAgICAgICJib20tcmVmIjogInVybjpsdXJlYm9tOmN5Y2xvbmVkeDphbHBoYS1iYXNlLW1vZGVsIiwKICAgICAgInR5cGUiOiAibWFjaGluZS1sZWFybmluZy1tb2RlbCIsCiAgICAgICJuYW1lIjogImJhc2UtbW9kZWwiLAogICAgICAidmVyc2lvbiI6ICI4OWFiY2RlZjAxMjM0NTY3IiwKICAgICAgInB1cmwiOiAicGtnOmh1Z2dpbmdmYWNlL2V4YW1wbGUvYmFzZS1tb2RlbEA4OWFiY2RlZjAxMjM0NTY3IiwKICAgICAgImhhc2hlcyI6IFsKICAgICAgICB7CiAgICAgICAgICAiYWxnIjogIlNIQS0yNTYiLAogICAgICAgICAgImNvbnRlbnQiOiAiOTk5OTk5OTk5OTk5OTk5OTk5OTk5OTk5OTk5OTk5OTk5OTk5OTk5OTk5OTk5OTk5OTk5OTk5OTk5OTk5OTk5OSIKICAgICAgICB9CiAgICAgIF0KICAgIH0KICBdLAogICJkZXBlbmRlbmNpZXMiOiBbCiAgICB7CiAgICAgICJyZWYiOiAidXJuOmx1cmVib206Y3ljbG9uZWR4OmFscGhhLWNvbnRhaW5lciIsCiAgICAgICJkZXBlbmRzT24iOiBbXQogICAgfSwKICAgIHsKICAgICAgInJlZiI6ICJ1cm46bHVyZWJvbTpjeWNsb25lZHg6YWxwaGEtbW9kZWwiLAogICAgICAiZGVwZW5kc09uIjogWyJ1cm46bHVyZWJvbTpjeWNsb25lZHg6YWxwaGEtYmFzZS1tb2RlbCJdCiAgICB9LAogICAgewogICAgICAicmVmIjogInVybjpsdXJlYm9tOmN5Y2xvbmVkeDphbHBoYS1wb2xpY3kiLAogICAgICAiZGVwZW5kc09uIjogW10KICAgIH0sCiAgICB7CiAgICAgICJyZWYiOiAidXJuOmx1cmVib206Y3ljbG9uZWR4OmFscGhhLWJhc2UtbW9kZWwiLAogICAgICAiZGVwZW5kc09uIjogW10KICAgIH0KICBdCn0K"},"spdx":{"document_sha256":"76bf0b73e6ac970642b97a87cbd405c8ead9f66fc818622cc8d74f2ef0240dd4","format":"spdx-3.0.1","payload_base64":"ewogICJAY29udGV4dCI6ICJodHRwczovL3NwZHgub3JnL3JkZi8zLjAuMS9zcGR4LWNvbnRleHQuanNvbmxkIiwKICAiQGdyYXBoIjogWwogICAgewogICAgICAiQGlkIjogIl86Y3JlYXRpb25pbmZvIiwKICAgICAgInR5cGUiOiAiQ3JlYXRpb25JbmZvIiwKICAgICAgInNwZWNWZXJzaW9uIjogIjMuMC4xIiwKICAgICAgImNyZWF0ZWQiOiAiMjAyNi0wOS0wNVQwMDowMTowMFoiLAogICAgICAiY3JlYXRlZEJ5IjogWyJ1cm46bHVyZWJvbTpzcGR4Om9yZ2FuaXphdGlvbiJdCiAgICB9LAogICAgewogICAgICAidHlwZSI6ICJPcmdhbml6YXRpb24iLAogICAgICAic3BkeElkIjogInVybjpsdXJlYm9tOnNwZHg6b3JnYW5pemF0aW9uIiwKICAgICAgImNyZWF0aW9uSW5mbyI6ICJfOmNyZWF